{
  "schema_version": "o4-cross-round-dynamics.v1",
  "runtime_authority": "JSON_INTERNAL_ONLY",
  "visibility": "teacher_safe",
  "exact_scope": { "tenant_id": "tenant_o4", "course_id": "course_o4", "run_id": "run_o4", "target_round_no": 3 },
  "candidate": {
    "candidate_id": "o4-cross-round-fixture",
    "status": "PROVEN",
    "horizon_rounds": 3,
    "source_team_count": 2,
    "source_state_ref_count": 6,
    "team_paths": [
      {
        "team_id": "team_alpha",
        "history_digest": "aaaaaaaaaaaaaaaaaaaaaaaaaaaaaaaaaaaaaaaaaaaaaaaaaaaaaaaaaaaaaaaa",
        "round_count": 3,
        "rounds": [
          { "round_no": 1, "round_id": "round_1", "closing_state_ref": { "tenant_id": "tenant_o4", "course_id": "course_o4", "run_id": "run_o4", "team_id": "team_alpha", "round_id": "round_1", "enterprise_state_id": "state_alpha_1", "version": 1, "state_digest": "1111111111111111111111111111111111111111111111111111111111111111" }, "metrics": { "cash": 1000, "capacity": 10, "portfolio_count": 1, "operating_unit_count": 1, "positioning": "value" }, "carryover_factors": [{ "kind": "CASH_POSITION", "direction": "INCREASED", "magnitude": 1000, "explanation": "cash" }, { "kind": "CAPACITY_POSITION", "direction": "INCREASED", "magnitude": 10, "explanation": "capacity" }, { "kind": "PORTFOLIO_COMMITMENT", "direction": "INCREASED", "magnitude": 1, "explanation": "portfolio" }, { "kind": "ORGANIZATION_SCALE", "direction": "INCREASED", "magnitude": 1, "explanation": "organization" }, { "kind": "POSITIONING_CONTINUITY", "direction": "INCREASED", "magnitude": 1, "explanation": "positioning" }] },
          { "round_no": 2, "round_id": "round_2", "closing_state_ref": { "tenant_id": "tenant_o4", "course_id": "course_o4", "run_id": "run_o4", "team_id": "team_alpha", "round_id": "round_2", "enterprise_state_id": "state_alpha_2", "version": 1, "state_digest": "2222222222222222222222222222222222222222222222222222222222222222" }, "metrics": { "cash": 900, "capacity": 12, "portfolio_count": 2, "operating_unit_count": 1, "positioning": "value" }, "carryover_factors": [{ "kind": "CASH_POSITION", "direction": "DECREASED", "magnitude": 100, "explanation": "cash" }, { "kind": "CAPACITY_POSITION", "direction": "INCREASED", "magnitude": 2, "explanation": "capacity" }, { "kind": "PORTFOLIO_COMMITMENT", "direction": "INCREASED", "magnitude": 1, "explanation": "portfolio" }, { "kind": "ORGANIZATION_SCALE", "direction": "UNCHANGED", "magnitude": 0, "explanation": "organization" }, { "kind": "POSITIONING_CONTINUITY", "direction": "UNCHANGED", "magnitude": 0, "explanation": "positioning" }] },
          { "round_no": 3, "round_id": "round_3", "closing_state_ref": { "tenant_id": "tenant_o4", "course_id": "course_o4", "run_id": "run_o4", "team_id": "team_alpha", "round_id": "round_3", "enterprise_state_id": "state_alpha_3", "version": 1, "state_digest": "3333333333333333333333333333333333333333333333333333333333333333" }, "metrics": { "cash": 850, "capacity": 14, "portfolio_count": 2, "operating_unit_count": 1, "positioning": "premium" }, "carryover_factors": [{ "kind": "CASH_POSITION", "direction": "DECREASED", "magnitude": 50, "explanation": "cash" }, { "kind": "CAPACITY_POSITION", "direction": "INCREASED", "magnitude": 2, "explanation": "capacity" }, { "kind": "PORTFOLIO_COMMITMENT", "direction": "UNCHANGED", "magnitude": 0, "explanation": "portfolio" }, { "kind": "ORGANIZATION_SCALE", "direction": "UNCHANGED", "magnitude": 0, "explanation": "organization" }, { "kind": "POSITIONING_CONTINUITY", "direction": "INCREASED", "magnitude": 1, "explanation": "positioning" }] }
        ]
      },
      {
        "team_id": "team_beta",
        "history_digest": "bbbbbbbbbbbbbbbbbbbbbbbbbbbbbbbbbbbbbbbbbbbbbbbbbbbbbbbbbbbbbbbb",
        "round_count": 3,
        "rounds": [
          { "round_no": 1, "round_id": "round_1", "closing_state_ref": { "tenant_id": "tenant_o4", "course_id": "course_o4", "run_id": "run_o4", "team_id": "team_beta", "round_id": "round_1", "enterprise_state_id": "state_beta_1", "version": 1, "state_digest": "4444444444444444444444444444444444444444444444444444444444444444" }, "metrics": { "cash": 1000, "capacity": 10, "portfolio_count": 1, "operating_unit_count": 1, "positioning": "value" }, "carryover_factors": [{ "kind": "CASH_POSITION", "direction": "INCREASED", "magnitude": 1000, "explanation": "cash" }, { "kind": "CAPACITY_POSITION", "direction": "INCREASED", "magnitude": 10, "explanation": "capacity" }, { "kind": "PORTFOLIO_COMMITMENT", "direction": "INCREASED", "magnitude": 1, "explanation": "portfolio" }, { "kind": "ORGANIZATION_SCALE", "direction": "INCREASED", "magnitude": 1, "explanation": "organization" }, { "kind": "POSITIONING_CONTINUITY", "direction": "INCREASED", "magnitude": 1, "explanation": "positioning" }] },
          { "round_no": 2, "round_id": "round_2", "closing_state_ref": { "tenant_id": "tenant_o4", "course_id": "course_o4", "run_id": "run_o4", "team_id": "team_beta", "round_id": "round_2", "enterprise_state_id": "state_beta_2", "version": 1, "state_digest": "5555555555555555555555555555555555555555555555555555555555555555" }, "metrics": { "cash": 980, "capacity": 10, "portfolio_count": 1, "operating_unit_count": 1, "positioning": "value" }, "carryover_factors": [{ "kind": "CASH_POSITION", "direction": "DECREASED", "magnitude": 20, "explanation": "cash" }, { "kind": "CAPACITY_POSITION", "direction": "UNCHANGED", "magnitude": 0, "explanation": "capacity" }, { "kind": "PORTFOLIO_COMMITMENT", "direction": "UNCHANGED", "magnitude": 0, "explanation": "portfolio" }, { "kind": "ORGANIZATION_SCALE", "direction": "UNCHANGED", "magnitude": 0, "explanation": "organization" }, { "kind": "POSITIONING_CONTINUITY", "direction": "UNCHANGED", "magnitude": 0, "explanation": "positioning" }] },
          { "round_no": 3, "round_id": "round_3", "closing_state_ref": { "tenant_id": "tenant_o4", "course_id": "course_o4", "run_id": "run_o4", "team_id": "team_beta", "round_id": "round_3", "enterprise_state_id": "state_beta_3", "version": 1, "state_digest": "6666666666666666666666666666666666666666666666666666666666666666" }, "metrics": { "cash": 940, "capacity": 10, "portfolio_count": 1, "operating_unit_count": 1, "positioning": "premium" }, "carryover_factors": [{ "kind": "CASH_POSITION", "direction": "DECREASED", "magnitude": 40, "explanation": "cash" }, { "kind": "CAPACITY_POSITION", "direction": "UNCHANGED", "magnitude": 0, "explanation": "capacity" }, { "kind": "PORTFOLIO_COMMITMENT", "direction": "UNCHANGED", "magnitude": 0, "explanation": "portfolio" }, { "kind": "ORGANIZATION_SCALE", "direction": "UNCHANGED", "magnitude": 0, "explanation": "organization" }, { "kind": "POSITIONING_CONTINUITY", "direction": "INCREASED", "magnitude": 1, "explanation": "positioning" }] }
        ]
      }
    ],
    "pair_differentials": [{ "left_team_id": "team_alpha", "right_team_id": "team_beta", "target_round_no": 3, "current_decision_match": "MATCHED", "history_different": true, "outcome_differential": { "cash": -90, "capacity": 4, "portfolio_count": 1, "operating_unit_count": 0 }, "explanatory_factors": [{ "kind": "CASH_POSITION", "direction": "DECREASED", "magnitude": 90, "explanation": "cash" }, { "kind": "CAPACITY_POSITION", "direction": "INCREASED", "magnitude": 4, "explanation": "capacity" }, { "kind": "PORTFOLIO_COMMITMENT", "direction": "INCREASED", "magnitude": 1, "explanation": "portfolio" }, { "kind": "ORGANIZATION_SCALE", "direction": "UNCHANGED", "magnitude": 0, "explanation": "organization" }, { "kind": "POSITIONING_CONTINUITY", "direction": "UNCHANGED", "magnitude": 0, "explanation": "positioning" }] }]
  },
  "provenance": { "source": "W4_ENTERPRISE_STATE_READ_MODEL", "state_ref_count": 6, "official_outcome_count": 6, "source_decision_count": 2, "replay_writes_formal_results": false },
  "authority": { "candidate_writer": "SIMULATION_CORE_READ_ONLY", "official_truth_write": false, "settlement_write": false, "replay_write": false, "provider_calls": 0 },
  "known_limits": ["bounded fixture"]
}
